movie_id,title,introduction,runtime,runtimeSeconds,rating,award,genre,releaseDate,releaseLocation,actors,directors
tt0036868,The Best Years of Our Lives,"Three World War II veterans, two of them traumatized or disabled, return home to the American midwest to discover that they and their families have been irreparably changed.",2h 50m,10200,"{'count': 70295, 'star': 8.1}","{'wins': 21, 'nominations': 3}","['Drama', 'Romance', 'War']",1947-05-29,Mexico,"['Myrna Loy', 'Dana Andrews', 'Fredric March']",['William Wyler']
tt0037343,Tall in the Saddle,Ranch hand Rocklin arrives in town to start his new job but his employer has been murdered and the locals don't seem too friendly.,1h 27m,5220,"{'count': 3471, 'star': 6.9}","{'wins': 0, 'nominations': 0}",['Western'],1944-09-29,United States,"['John Wayne', 'Ella Raines', 'Ward Bond']",['Edwin L. Marin']
tt0037671,The Enchanted Cottage,A plain maid and a wounded war veteran are transformed by their love for each other while residing in an enchanted honeymoon cottage.,1h 31m,5460,"{'count': 3515, 'star': 7.5}","{'wins': 0, 'nominations': 1}","['Drama', 'Fantasy', 'Romance']",1945-06-29,Mexico,"['Dorothy McGuire', 'Robert Young', 'Herbert Marshall']",['John Cromwell']
tt0037721,Frontier Gal,A wanderer returns after six years and a one-night honeymoon to make amends with his bride and five year-old daughter.,1h 25m,5100,"{'count': 396, 'star': 5.9}","{'wins': 0, 'nominations': 0}",['Western'],1945-12-21,United States,"['Yvonne De Carlo', 'Rod Cameron', 'Andy Devine']",['Charles Lamont']
tt0037981,The Pearl,The discovery of a perfect pearl forever changes the lives of a poor Mexican fisherman and his family.,1h 25m,5100,"{'count': 1113, 'star': 7.4}","{'wins': 9, 'nominations': 6}","['Adventure', 'Drama', 'Romance']",1947-09-12,Mexico,"['Pedro Armendáriz', 'María Elena Marqués', 'Fernando Wagner']",['Emilio Fernández']
tt0037991,Pink String and Sealing Wax,"A drunken, abusive tavern-keeper's adulterous wife uses the backward son of a rigid, puritanical pharmacist who makes his entire family miserable.",1h 29m,5340,"{'count': 682, 'star': 6.7}","{'wins': 0, 'nominations': 0}","['Drama', 'Thriller']",1950-10-02,United States,"['Mervyn Johns', 'Mary Merrall', 'Gordon Jackson']",['Robert Hamer']
tt0038250,The Wicked Lady,A noblewoman begins to lead a dangerous double life in order to alleviate her boredom.,1h 37m,5820,"{'count': 1631, 'star': 6.8}","{'wins': 0, 'nominations': 0}","['Adventure', 'Drama']",1946-12-21,United States,"['Margaret Lockwood', 'James Mason', 'Patricia Roc']",['Leslie Arliss']
tt0038458,Deadline at Dawn,"After a woman he meets is murdered, a soon-to-ship-out sailor has until dawn to find the killer, aided by a weary dance hall girl.",1h 23m,4980,"{'count': 2130, 'star': 6.8}","{'wins': 0, 'nominations': 1}","['Crime', 'Film-Noir', 'Mystery', 'Romance']",1946-03-18,Sweden,"['Susan Hayward', 'Paul Lukas', 'Bill Williams']","['Harold Clurman', 'William Cameron Menzies']"
tt0038650,It's a Wonderful Life,An angel is sent from Heaven to help a desperately frustrated businessman by showing him what life would have been like if he had never existed.,2h 10m,7800,"{'count': 497613, 'star': 8.6}","{'wins': 7, 'nominations': 6}","['Drama', 'Family', 'Fantasy', 'Romance']",1947-01-07,United States,"['James Stewart', 'Donna Reed', 'Lionel Barrymore']",['Frank Capra']
tt0038721,The Man I Love,"A homesick, no-nonsense lounge singer decides to leave New York City to spend some time visiting her two sisters and brother on the West Coast. Eventually she falls in love with a down-and-out ex-jazz pianist.",1h 36m,5760,"{'count': 1319, 'star': 6.7}","{'wins': 0, 'nominations': 0}","['Drama', 'Film-Noir', 'Music']",1947-01-11,United States,"['Ida Lupino', 'Robert Alda', 'Andrea King']",['Raoul Walsh']
tt0039204,Body and Soul,A talented boxer's young career hits difficult terrain when an unethical promoter takes interest in him.,1h 44m,6240,"{'count': 5348, 'star': 7.6}","{'wins': 1, 'nominations': 4}","['Drama', 'Film-Noir', 'Sport']",1947-11-11,United States,"['John Garfield', 'Lilli Palmer', 'Hazel Brooks']",['Robert Rossen']
tt0039217,The Brasher Doubloon,Detective Philip Marlowe encounters a variety of characters while checking on why Leslie Murdock stole a rare doubloon from his mother.,1h 12m,4320,"{'count': 1378, 'star': 6.5}","{'wins': 0, 'nominations': 0}","['Crime', 'Drama', 'Film-Noir', 'Mystery']",1947-02-06,United States,"['George Montgomery', 'Nancy Guild', 'Conrad Janis']",['John Brahm']
tt0039308,Deep Valley,"A girl living with her parents on an isolated California farm falls in love with a chain-gang convict working at a nearby highway construction site, and sets out to help him when he escapes.",1h 44m,6240,"{'count': 1061, 'star': 6.8}","{'wins': 0, 'nominations': 0}","['Action', 'Crime', 'Drama', 'Romance']",1947-07-30,United States,"['Ida Lupino', 'Dane Clark', 'Wayne Morris']",['Jean Negulesco']
tt0039311,Desert Fury,"The daughter of a Nevada casino owner gets involved with a racketeer, despite everyone's efforts to separate them.",1h 36m,5760,"{'count': 1962, 'star': 6.5}","{'wins': 0, 'nominations': 0}","['Crime', 'Drama', 'Film-Noir', 'Romance', 'Thriller']",1947-08-15,United States,"['John Hodiak', 'Lizabeth Scott', 'Burt Lancaster']",['Lewis Allen']
tt0039482,I Walk Alone,Frankie Madison leaves prison expecting a share from his ex-partner. But Prohibition bootlegging didn't prepare Frankie for Big Business.,1h 37m,5820,"{'count': 3278, 'star': 7}","{'wins': 0, 'nominations': 0}","['Crime', 'Drama', 'Film-Noir']",1948-01-16,United States,"['Burt Lancaster', 'Lizabeth Scott', 'Kirk Douglas']",['Byron Haskin']
tt0039666,Nora Prentiss,"A doctor spins an ever-growing web of lies after a taste of the excitement that he was missing in his conventional life, thanks to a chance meeting with a nightclub singer.",1h 51m,6660,"{'count': 2049, 'star': 7.1}","{'wins': 0, 'nominations': 0}","['Drama', 'Film-Noir']",1947-02-22,United States,"['Ann Sheridan', 'Kent Smith', 'Bruce Bennett']",['Vincent Sherman']
tt0039739,Jenny Lamour,"A flirtatious wife runs off to meet an older man and the husband closes in with intend to murder him, but finds the deed already done.",1h 46m,6360,"{'count': 6387, 'star': 7.7}","{'wins': 2, 'nominations': 1}","['Crime', 'Drama']",1948-03-05,United States,"['Louis Jouvet', 'Simone Renant', 'Bernard Blier']",['Henri-Georges Clouzot']
tt0039750,Ramrod,"Violent feud between Connie Dickason, the owner of the Circle 66 ranch and rancher Frank Ivey, the self-proclaimed boss of an otherwise public grazing land.",1h 34m,5640,"{'count': 1840, 'star': 6.7}","{'wins': 0, 'nominations': 0}","['Action', 'Romance', 'Western']",1947-05-02,United States,"['Joel McCrea', 'Veronica Lake', 'Don DeFore']",['André De Toth']
tt0039761,Repeat Performance,"On New Year's Eve 1946, Sheila Page kills her husband Barney. She wishes that she could relive 1946 and avoid the mistakes that she made throughout the year. Her wish comes true but cheating fate proves more difficult than she anticipated.",1h 31m,5460,"{'count': 1945, 'star': 6.8}","{'wins': 0, 'nominations': 0}","['Crime', 'Drama', 'Fantasy', 'Film-Noir', 'Mystery']",1947-09-15,United Kingdom,"['Louis Hayward', 'Joan Leslie', 'Virginia Field']",['Alfred L. Werker']
tt0039806,The Sea of Grass,"On America's frontier, a St. Louis woman marries a New Mexico cattleman who is seen as a tyrant by the locals.",2h 3m,7380,"{'count': 2434, 'star': 6.3}","{'wins': 0, 'nominations': 0}","['Drama', 'Western']",1947-04-25,United States,"['Katharine Hepburn', 'Spencer Tracy', 'Robert Walker']",['Elia Kazan']
tt0039908,Trail Street,"Bat Masterson's old friend Billy Burns convinces him to become marshal of Liberal, Kansas and help the residents fight drought and a destructive range war.",1h 24m,5040,"{'count': 823, 'star': 6.2}","{'wins': 0, 'nominations': 0}",['Western'],1947-02-19,United States,"['Randolph Scott', 'Robert Ryan', 'Anne Jeffreys']",['Ray Enright']
tt0039931,Unconquered,Intrepid frontiersman Chris Holden foils the political and personal ambitions of renegade Martin Garth in the Ohio Valley following the French and Indian War.,2h 26m,8760,"{'count': 2876, 'star': 6.8}","{'wins': 0, 'nominations': 1}","['Adventure', 'Drama', 'History', 'Romance', 'Western']",1947-10-10,United States,"['Gary Cooper', 'Paulette Goddard', 'Howard Da Silva']",['Cecil B. DeMille']
tt0039937,The Unfaithful,A Los Angeles socialite kills a man while home alone one night and claims he was an intruder she did not know. It seems like a clear case of self defense until the story hits the papers and people connected to the dead man come forward.,1h 49m,6540,"{'count': 1615, 'star': 6.8}","{'wins': 0, 'nominations': 0}","['Crime', 'Drama', 'Film-Noir', 'Mystery']",1947-07-01,United States,"['Ann Sheridan', 'Lew Ayres', 'Zachary Scott']",['Vincent Sherman']
tt0039984,While I Live,"25 years later, a spinster still obsesses over the death of her composer sister and concludes she has returned, reincarnated, in an amnesiac woman who chances upon her house seeking help.",1h 25m,5100,"{'count': 167, 'star': 6.5}","{'wins': 0, 'nominations': 0}",['Thriller'],1949-07-07,Mexico,"['Tom Walls', 'Clifford Evans', 'Carol Raye']",['John Harlow']
tt0040068,Abbott and Costello Meet Frankenstein,The Wolf Man tries to warn a dimwitted porter that Dracula wants his brain for Frankenstein monster's body.,1h 23m,4980,"{'count': 19509, 'star': 7.3}","{'wins': 4, 'nominations': 2}","['Comedy', 'Family', 'Fantasy', 'Horror', 'Sci-Fi']",1948-06-15,United States,"['Bud Abbott', 'Lou Costello', 'Lon Chaney Jr.']","['Charles Barton', 'Walter Lantz']"
tt0040491,Joan of Arc,The abbreviated life of the 15th-century French heroine.,2h 25m,8700,"{'count': 3758, 'star': 6.4}","{'wins': 4, 'nominations': 6}","['Biography', 'Drama', 'War']",1948-11-11,Brazil,"['Ingrid Bergman', 'José Ferrer', 'Selena Royle']",['Victor Fleming']
tt0040522,Bicycle Thieves,"In post-war Italy, a working-class man's bicycle is stolen, endangering his efforts to find work. He and his son set out to find it.",1h 29m,5340,"{'count': 174531, 'star': 8.3}","{'wins': 18, 'nominations': 1}",['Drama'],1949-12-13,United States,"['Lamberto Maggiorani', 'Enzo Staiola', 'Lianella Carell']",['Vittorio De Sica']
tt0040695,Pitfall,Married insurance adjuster John Forbes falls for femme fatale Mona Stevens while her boyfriend is in jail and all suffer serious consequences as a result.,1h 26m,5160,"{'count': 4512, 'star': 7.1}","{'wins': 0, 'nominations': 0}","['Crime', 'Film-Noir', 'Thriller']",1948-08-24,United States,"['Dick Powell', 'Lizabeth Scott', 'Jane Wyatt']",['André De Toth']
tt0040751,Ruthless,"A poor boy who saved a rich girl from drowning is adopted by her family, but he grows into a money-hungry ruthless businessman who would step on others to get to the top of the social ladder.",1h 44m,6240,"{'count': 1394, 'star': 6.8}","{'wins': 0, 'nominations': 0}","['Drama', 'Film-Noir', 'Romance']",1948-10-27,Mexico,"['Zachary Scott', 'Louis Hayward', 'Diana Lynn']",['Edgar G. Ulmer']
tt0040887,To the Ends of the Earth,"After witnessing an incident on a foreign ship off California coast, a U.S. Treasury agent aboard a Coast Guard vessel decides to further investigate the matter by following a crime trail leading to China, Egypt, Lebanon and Cuba.",1h 49m,6540,"{'count': 946, 'star': 6.8}","{'wins': 0, 'nominations': 1}","['Crime', 'Film-Noir', 'Thriller']",1948-02-27,United States,"['Dick Powell', 'Signe Hasso', 'Maylia']",['Robert Stevenson']
tt0040897,The Treasure of the Sierra Madre,Two down-on-their-luck Americans searching for work in 1920s Mexico convince an old prospector to help them mine for gold in the Sierra Madre Mountains.,2h 6m,7560,"{'count': 132042, 'star': 8.2}","{'wins': 15, 'nominations': 5}","['Adventure', 'Drama', 'Western']",1948-01-24,United States,"['Humphrey Bogart', 'Walter Huston', 'Tim Holt']",['John Huston']
tt0040947,Walk a Crooked Mile,"During the Cold War, at a California atomic research plant, an FBI agent and a Scotland Yard inspector join forces to eliminate a foreign atomic spy ring operating in the USA and the UK.",1h 31m,5460,"{'count': 1130, 'star': 6.3}","{'wins': 0, 'nominations': 0}","['Crime', 'Drama', 'Film-Noir']",1948-09-02,United States,"['Louis Hayward', ""Dennis O'Keefe"", 'Louise Allbritton']",['Gordon Douglas']
tt0041172,Beyond the Forest,"Resentful of her small-town life, a married woman schemes to run off with a rich businessman.",1h 37m,5820,"{'count': 2760, 'star': 6.8}","{'wins': 0, 'nominations': 1}","['Drama', 'Film-Noir', 'Romance', 'Thriller']",1949-10-21,United States,"['Bette Davis', 'Joseph Cotten', 'David Brian']",['King Vidor']
tt0041634,Manon,A classic tale about bitter relationships between a frivolous girl and a soldier is adapted for the post-World War II time.,1h 40m,6000,"{'count': 1167, 'star': 6.8}","{'wins': 2, 'nominations': 0}","['Crime', 'Drama']",1949-03-09,France,"['Serge Reggiani', 'Michel Auclair', 'Cécile Aubry']",['Henri-Georges Clouzot']
tt0041694,No Man of Her Own,"A pregnant woman adopts the identity of a railroad-crash victim and starts a new life with the woman's wealthy in-laws, but is soon blackmailed by her devious ex.",1h 38m,5880,"{'count': 2893, 'star': 7.3}","{'wins': 0, 'nominations': 0}","['Drama', 'Film-Noir', 'Romance']",1950-06-05,United Kingdom,"['Barbara Stanwyck', 'John Lund', 'Jane Cowl']",['Mitchell Leisen']
tt0041959,The Third Man,"Pulp novelist Holly Martins travels to shadowy, postwar Vienna, only to find himself investigating the mysterious death of an old friend, Harry Lime.",1h 33m,5580,"{'count': 181282, 'star': 8.1}","{'wins': 5, 'nominations': 4}","['Film-Noir', 'Mystery', 'Thriller']",1950-02-01,United States,"['Orson Welles', 'Joseph Cotten', 'Alida Valli']",['Carol Reed']
tt0042192,All About Eve,A seemingly timid but secretly ruthless ingénue insinuates herself into the lives of an aging Broadway star and her circle of theater friends.,2h 18m,8280,"{'count': 138386, 'star': 8.2}","{'wins': 27, 'nominations': 20}",['Drama'],1950-10-27,United States,"['Bette Davis', 'Anne Baxter', 'George Sanders']",['Joseph L. Mankiewicz']
tt0042219,Backfire,"While recuperating from wartime back injuries at a hospital, veteran Bob Corey is visited on Christmas Eve by a beautiful stranger with an even stranger message.",1h 31m,5460,"{'count': 1785, 'star': 6.6}","{'wins': 0, 'nominations': 1}","['Crime', 'Film-Noir', 'Mystery', 'Romance', 'Thriller']",1950-02-11,United States,"['Viveca Lindfors', 'Dane Clark', 'Virginia Mayo']",['Vincent Sherman']
tt0042482,Frenchie,"Frenchie Fontaine sells her successful business in New Orleans to come West. Her reason? Find the men who killed her father, Frank Dawson. But she only knows one of the two who did and she's determined to find out the other.",1h 21m,4860,"{'count': 562, 'star': 6.3}","{'wins': 0, 'nominations': 0}",['Western'],1951-04-20,Australia,"['Joel McCrea', 'Shelley Winters', 'Paul Kelly']",['Louis King']
tt0042582,Hunt the Man Down,"The suspect in a 12-year-old murder case is finally caught and tried, but the witnesses are a bit hard to track down...",1h 9m,4140,"{'count': 1048, 'star': 6.5}","{'wins': 0, 'nominations': 0}","['Crime', 'Film-Noir', 'Mystery']",1950-12-26,United States,"['Gig Young', 'Lynne Roberts', 'Mary Anderson']",['George Archainbaud']
tt0042870,The Quiet Woman,Coastal pub proprietress is inveigled into a smuggling plot.,1h 11m,4260,"{'count': 235, 'star': 5.9}","{'wins': 0, 'nominations': 0}","['Crime', 'Drama']",1951-02-28,United Kingdom,"['Derek Bond', 'Jane Hylton', 'Dora Bryan']",['John Gilling']
tt0042876,Rashomon,"The rape of a bride and the murder of her samurai husband are recalled from the perspectives of a bandit, the bride, the samurai's ghost and a woodcutter.",1h 28m,5280,"{'count': 179702, 'star': 8.2}","{'wins': 9, 'nominations': 5}","['Crime', 'Drama', 'Mystery']",1951-12-26,United States,"['Toshirô Mifune', 'Machiko Kyô', 'Masayuki Mori']",['Akira Kurosawa']
tt0042963,Sierra,A tomboy frontier lawyer finds an outlaw and his son hiding out from a false murder charge.,1h 23m,4980,"{'count': 1069, 'star': 6.4}","{'wins': 0, 'nominations': 0}",['Western'],1950-06-01,United States,"['Audie Murphy', 'Wanda Hendrix', 'Burl Ives']",['Alfred E. Green']
tt0043014,Sunset Blvd.,A screenwriter develops a dangerous relationship with a faded film star determined to make a triumphant return.,1h 50m,6600,"{'count': 235585, 'star': 8.4}","{'wins': 19, 'nominations': 20}","['Drama', 'Film-Noir']",1950-08-04,Turkey,"['William Holden', 'Gloria Swanson', 'Erich von Stroheim']",['Billy Wilder']
tt0043338,Ace in the Hole,"A frustrated former big-city journalist now stuck working for an Albuquerque newspaper exploits a story about a man trapped in a cave to rekindle his career, but the situation quickly escalates into an out-of-control circus.",1h 51m,6660,"{'count': 38999, 'star': 8.1}","{'wins': 4, 'nominations': 3}","['Drama', 'Film-Noir']",1951-07-04,United States,"['Kirk Douglas', 'Jan Sterling', 'Robert Arthur']",['Billy Wilder']
tt0043677,Inside the Walls of Folsom Prison,"At California's Folsom Prison, escape attempts and riots are on the rise due to the old-school sadistic style of management of a brutal warden.",1h 27m,5220,"{'count': 410, 'star': 6.6}","{'wins': 0, 'nominations': 0}","['Crime', 'Drama', 'Film-Noir']",1951-05-18,United States,"['Steve Cochran', 'David Brian', 'Philip Carey']",['Crane Wilbur']
tt0043752,The Long Dark Hall,"A devoted family man tries to help a beautiful alcoholic showgirl with her life, and becomes the only suspect when someone else murders her.",1h 26m,5160,"{'count': 504, 'star': 6.3}","{'wins': 0, 'nominations': 0}","['Crime', 'Drama']",1951-09-14,Australia,"['Rex Harrison', 'Lilli Palmer', 'Tania Heald']","['Reginald Beck', 'Anthony Bushell']"
tt0043766,M,"In this Americanization of the 1931 German thriller, both the police and the criminal underworld stalk a mysterious serial killer who preys on little girls.",1h 28m,5280,"{'count': 2352, 'star': 6.8}","{'wins': 0, 'nominations': 0}","['Crime', 'Drama', 'Film-Noir', 'Thriller']",1951-02-28,United States,"['David Wayne', 'Howard Da Silva', 'Martin Gabel']",['Joseph Losey']
tt0043861,No Questions Asked,"An insurance lawyer unhappy with his rate of company advancement becomes a middleman in deals to recover stolen property from the Mob, thus earning a nice living. But his actions attract police attention and set him up for a double-cross.",1h 20m,4800,"{'count': 749, 'star': 6.6}","{'wins': 0, 'nominations': 0}","['Crime', 'Drama', 'Film-Noir', 'Mystery', 'Romance']",1951-06-15,United States,"['Barry Sullivan', 'Arlene Dahl', 'George Murphy']",['Harold F. Kress']
tt0044490,Cattle Town,"Post-civil-war Texas sells lands to wealthy Northerners but some of them are crooks bent on cheating the locals, prompting an investigation headed by the governor's envoy.",1h 11m,4260,"{'count': 221, 'star': 5.4}","{'wins': 0, 'nominations': 0}",['Western'],1952-09-06,United States,"['Dennis Morgan', 'Philip Carey', 'Amanda Blake']",['Noel M. Smith']
tt0044502,Clash by Night,"Mae Doyle comes back to her hometown a cynical woman. Her brother Joe fears that his love, fish cannery worker Peggy, may wind up like Mae. Mae marries Jerry and has a baby; she is happy but restless, drawn to Jerry's friend Earl.",1h 45m,6300,"{'count': 7331, 'star': 7}","{'wins': 0, 'nominations': 0}","['Drama', 'Film-Noir', 'Romance']",1952-06-06,United States,"['Barbara Stanwyck', 'Robert Ryan', 'Paul Douglas']",['Fritz Lang']
tt0044741,Ikiru,A bureaucrat tries to find meaning in his life after he discovers he has terminal cancer.,2h 23m,8580,"{'count': 87016, 'star': 8.3}","{'wins': 6, 'nominations': 2}",['Drama'],1956-03-25,United States,"['Takashi Shimura', 'Nobuo Kaneko', ""Shin'ichi Himori""]",['Akira Kurosawa']
tt0044860,The Lusty Men,Retired rodeo champion Jeff McCloud agrees to mentor novice rodeo contestant Wes Merritt against the wishes of Merritt's wife who fears the dangers of this rough sport.,1h 53m,6780,"{'count': 3641, 'star': 7.3}","{'wins': 0, 'nominations': 0}","['Action', 'Drama', 'Sport', 'Western']",1952-10-24,United States,"['Susan Hayward', 'Robert Mitchum', 'Arthur Kennedy']","['Nicholas Ray', 'Robert Parrish']"
tt0044937,My Cousin Rachel,"A young man plots revenge against the woman he believes murdered his cousin, but his plans are shaken when he comes face to face with the enigmatic beauty.",1h 38m,5880,"{'count': 3379, 'star': 7}","{'wins': 1, 'nominations': 5}","['Drama', 'Mystery', 'Romance']",1954-12-24,United States,"['Olivia de Havilland', 'Richard Burton', 'Audrey Dalton']",['Henry Koster']
tt0045152,Singin' in the Rain,A silent film star falls for a chorus girl just as he and his delusionally jealous screen partner are trying to make the difficult transition to talking pictures in 1920s Hollywood.,1h 43m,6180,"{'count': 259645, 'star': 8.3}","{'wins': 8, 'nominations': 9}","['Comedy', 'Musical', 'Romance']",1952-04-10,United States,"['Gene Kelly', ""Donald O'Connor"", 'Debbie Reynolds']","['Stanley Donen', 'Gene Kelly']"
tt0046268,The Wages of Fear,"In a decrepit South American village, four men are hired to transport an urgent nitroglycerine shipment without the equipment that would make it safe.",2h 11m,7860,"{'count': 66186, 'star': 8.2}","{'wins': 7, 'nominations': 1}","['Adventure', 'Drama', 'Thriller']",1955-02-16,United States,"['Yves Montand', 'Charles Vanel', 'Peter van Eyck']",['Henri-Georges Clouzot']
tt0046438,Tokyo Story,"An old couple visit their children and grandchildren in the city, but receive little attention.",2h 16m,8160,"{'count': 68204, 'star': 8.1}","{'wins': 3, 'nominations': 0}",['Drama'],1972-03-13,United States,"['Chishû Ryû', 'Chieko Higashiyama', 'Sô Yamamura']",['Yasujirô Ozu']
tt0046514,Vice Squad,Police procedural film following a few cases assigned to LAPD captain of detectives Barnie Barnaby.,1h 28m,5280,"{'count': 807, 'star': 6.6}","{'wins': 0, 'nominations': 0}","['Crime', 'Drama', 'Film-Noir', 'Thriller']",1953-07-31,United States,"['Edward G. Robinson', 'Paulette Goddard', 'K.T. Stevens']",['Arnold Laven']
tt0046791,Black Widow,A young writer insinuates herself into the life of a Broadway producer.,1h 35m,5700,"{'count': 3236, 'star': 6.7}","{'wins': 0, 'nominations': 0}","['Drama', 'Film-Noir', 'Mystery']",1954-11-12,Canada,"['Ginger Rogers', 'Van Heflin', 'Gene Tierney']",['Nunnally Johnson']
tt0046800,Border River,A Confederate officer and his men journey to Mexico to buy guns to continue the war effort. A Union officer determines to stop them.,1h 20m,4800,"{'count': 609, 'star': 6}","{'wins': 0, 'nominations': 0}",['Western'],1953-12-31,United States,"['Joel McCrea', 'Yvonne De Carlo', 'Pedro Armendáriz']",['George Sherman']
tt0047296,On the Waterfront,"An ex-prize fighter turned New Jersey longshoreman struggles to stand up to his corrupt union bosses, including his older brother, as he starts to connect with the grieving sister of one of the syndicate's victims.",1h 48m,6480,"{'count': 164132, 'star': 8.1}","{'wins': 30, 'nominations': 10}","['Crime', 'Drama', 'Thriller']",1954-06-22,Japan,"['Marlon Brando', 'Karl Malden', 'Lee J. Cobb']",['Elia Kazan']
tt0047298,One Good Turn,"Norman is the oldest orphan at Greenwood Children's Home and now acts as their caretaker. All the orphans are very happy and well cared for. The adventures start when a nasty property developer (boo hiss!) who is also the chairman of the orphanage board wants to close the orphanage and build a factory on the site. The children are sent to Brighton for the day and Norman is very excited because he's ""never seen the sea"". When they get back, they discover the plan to close the orphanage and must decide what to do.",1h 30m,5400,"{'count': 668, 'star': 6.5}","{'wins': 0, 'nominations': 0}",['Comedy'],1955-02-17,Portugal,"['Norman Wisdom', 'Joan Rice', 'Shirley Abicair']",['John Paddy Carstairs']
tt0047396,Rear Window,"A photographer in a wheelchair spies on his neighbors from his Greenwich Village courtyard apartment window, and becomes convinced one of them has committed murder, despite the skepticism of his fashion-model girlfriend.",1h 52m,6720,"{'count': 520348, 'star': 8.5}","{'wins': 6, 'nominations': 13}","['Mystery', 'Thriller']",1954-09-01,United States,"['James Stewart', 'Grace Kelly', 'Wendell Corey']",['Alfred Hitchcock']
tt0047478,Seven Samurai,"Farmers from a village exploited by bandits hire a veteran samurai for protection, who gathers six other samurai to join him.",3h 27m,12420,"{'count': 365597, 'star': 8.6}","{'wins': 5, 'nominations': 9}","['Action', 'Drama']",1956-11-19,United States,"['Toshirô Mifune', 'Takashi Shimura', 'Keiko Tsushima']",['Akira Kurosawa']
tt0047976,Dementia,"This film, with no dialogue at all, follows a psychotic young woman's nightmarish experiences through one skid-row night.",1h 1m,3660,"{'count': 2560, 'star': 6.7}","{'wins': 0, 'nominations': 0}","['Film-Noir', 'Horror', 'Mystery']",1955-12-22,United States,"['Adrienne Barrett', 'Bruno VeSota', 'Ben Roseman']","['John Parker', 'Bruno VeSota']"
tt0048140,Guys and Dolls,"In New York, a gambler is challenged to take a cold female missionary to Havana, but they fall for each other, and the bet has a hidden motive to finance a crap game.",2h 30m,9000,"{'count': 19221, 'star': 7.1}","{'wins': 3, 'nominations': 7}","['Comedy', 'Crime', 'Musical', 'Romance']",1955-12-23,United States,"['Marlon Brando', 'Jean Simmons', 'Frank Sinatra']",['Joseph L. Mankiewicz']
