movie_id,title,introduction,runtime,runtimeSeconds,rating,award,genre,releaseDate,releaseLocation,actors,directors
tt0087843,Once Upon a Time in America,"A former Prohibition-era Jewish gangster returns to the Lower East Side of Manhattan 35 years later, where he must once again confront the ghosts and regrets of his old life.",3h 49m,13740,"{'count': 376249, 'star': 8.3}","{'wins': 11, 'nominations': 13}","['Crime', 'Drama']",1984-06-01,United States,"['Robert De Niro', 'James Woods', 'Elizabeth McGovern']",['Sergio Leone']
tt0088247,The Terminator,"A human soldier is sent from 2029 to 1984 to stop an almost indestructible cyborg killing machine, sent from the same year, which has been programmed to execute a young woman whose unborn son is the key to humanity's future salvation.",1h 47m,6420,"{'count': 920926, 'star': 8.1}","{'wins': 8, 'nominations': 7}","['Action', 'Adventure', 'Sci-Fi']",1984-10-26,United States,"['Arnold Schwarzenegger', 'Linda Hamilton', 'Michael Biehn']",['James Cameron']
tt0088763,Back to the Future,"Marty McFly, a 17-year-old high school student, is accidentally sent 30 years into the past in a time-traveling DeLorean invented by his close friend, the maverick scientist Doc Brown.",1h 56m,6960,"{'count': 1300855, 'star': 8.5}","{'wins': 25, 'nominations': 25}","['Adventure', 'Comedy', 'Sci-Fi']",1985-07-03,United States,"['Michael J. Fox', 'Christopher Lloyd', 'Lea Thompson']",['Robert Zemeckis']
tt0088930,Clue,"Six guests are anonymously invited to a strange mansion for dinner, but after their host is killed, they must cooperate with the staff to identify the murderer as the bodies pile up.",1h 34m,5640,"{'count': 108827, 'star': 7.2}","{'wins': 0, 'nominations': 0}","['Comedy', 'Crime', 'Mystery', 'Thriller']",1985-12-13,United States,"['Eileen Brennan', 'Tim Curry', 'Madeline Kahn']",['Jonathan Lynn']
tt0088944,Commando,"A retired Special Forces colonel tries to save his daughter, who was abducted by his former subordinate.",1h 30m,5400,"{'count': 174312, 'star': 6.7}","{'wins': 0, 'nominations': 2}","['Action', 'Adventure', 'Thriller']",1985-10-04,United States,"['Arnold Schwarzenegger', 'Rae Dawn Chong', 'Dan Hedaya']",['Mark L. Lester']
tt0089013,Demons,"A group of random people are invited to a screening of a mysterious movie, only to find themselves trapped in the theater with ravenous demons.",1h 28m,5280,"{'count': 26437, 'star': 6.6}","{'wins': 0, 'nominations': 2}",['Horror'],1986-05-30,United States,"['Urbano Barberini', 'Natasha Hovey', 'Karl Zinny']",['Lamberto Bava']
tt0089880,Rambo: First Blood Part II,Rambo returns to the jungles of Vietnam on a mission to infiltrate an enemy base-camp and rescue the American POWs still held captive there.,1h 36m,5760,"{'count': 181947, 'star': 6.5}","{'wins': 5, 'nominations': 7}","['Action', 'Adventure', 'Thriller']",1985-05-22,United States,"['Sylvester Stallone', 'Richard Crenna', 'Charles Napier']",['George P. Cosmatos']
tt0089881,Ran,"In Medieval Japan, an elderly warlord retires, handing over his empire to his three sons. However, he vastly underestimates how the new-found power will corrupt them and cause them to turn on each other...and him.",2h 40m,9600,"{'count': 135560, 'star': 8.2}","{'wins': 30, 'nominations': 23}","['Action', 'Drama', 'War']",1985-06-01,Japan,"['Tatsuya Nakadai', 'Akira Terao', 'Jinpachi Nezu']",['Akira Kurosawa']
tt0090605,Aliens,"Decades after surviving the Nostromo incident, Ellen Ripley is sent out to re-establish contact with a terraforming colony but finds herself battling the Alien Queen and her offspring.",2h 17m,8220,"{'count': 759892, 'star': 8.4}","{'wins': 20, 'nominations': 25}","['Action', 'Adventure', 'Sci-Fi', 'Thriller']",1986-07-18,United States,"['Sigourney Weaver', 'Michael Biehn', 'Carrie Henn']",['James Cameron']
tt0090756,Blue Velvet,"The discovery of a severed human ear found in a field leads a young man on an investigation related to a beautiful, mysterious nightclub singer and a group of psychopathic criminals who have kidnapped her child.",2h,7200,"{'count': 214986, 'star': 7.7}","{'wins': 18, 'nominations': 18}","['Crime', 'Drama', 'Mystery', 'Thriller']",1986-10-23,Italy,"['Isabella Rossellini', 'Kyle MacLachlan', 'Dennis Hopper']",['David Lynch']
tt0090774,Brighton Beach Memoirs,"Eugene, a young teenage Jewish boy, recalls his memoirs of his time as an adolescent youth. He goes through the hardships of puberty, sexual fantasy, and living the life of a poor boy in a crowded house.",1h 48m,6480,"{'count': 3855, 'star': 6.8}","{'wins': 0, 'nominations': 0}",['Comedy'],1986-12-25,United States,"['Blythe Danner', 'Jonathan Silverman', 'Stacey Glick']",['Gene Saks']
tt0090859,Cobra,A tough-on-crime street cop must protect the only surviving witness to a strange murderous cult with far-reaching plans.,1h 27m,5220,"{'count': 79348, 'star': 5.8}","{'wins': 0, 'nominations': 6}","['Action', 'Crime', 'Thriller']",1986-05-23,United States,"['Sylvester Stallone', 'Brigitte Nielsen', 'Reni Santoni']",['George P. Cosmatos']
tt0091251,Come and See,"After finding an old rifle, a young boy joins the Soviet resistance movement against ruthless German forces and experiences the horrors of World War II.",2h 22m,8520,"{'count': 96115, 'star': 8.4}","{'wins': 3, 'nominations': 0}","['Drama', 'Thriller', 'War']",1985-09-03,Philippines,"['Aleksey Kravchenko', 'Olga Mironova', 'Liubomiras Laucevicius']",['Elem Klimov']
tt0091763,Platoon,"Chris Taylor, a neophyte recruit in Vietnam, finds himself caught in a battle of wills between two sergeants, one good and the other evil. A shrewd examination of the brutality of war and the duality of man in conflict.",2h,7200,"{'count': 438085, 'star': 8.1}","{'wins': 24, 'nominations': 16}","['Drama', 'War']",1987-02-06,United States,"['Charlie Sheen', 'Tom Berenger', 'Willem Dafoe']",['Oliver Stone']
tt0091828,Raw Deal,A former FBI agent turned small-town sheriff agrees to help the FBI chief infiltrate the Chicago mafia when the FBI chief's son is killed by them.,1h 46m,6360,"{'count': 37471, 'star': 5.6}","{'wins': 0, 'nominations': 0}","['Action', 'Crime', 'Thriller']",1986-06-06,United States,"['Arnold Schwarzenegger', 'Kathryn Harrold', 'Sam Wanamaker']",['John Irvin']
tt0091860,River's Edge,"A high school slacker commits a shocking act and proceeds to let his friends in on the secret. However, the friends' reaction is almost as ambiguous and perplexing as the crime itself.",1h 39m,5940,"{'count': 20540, 'star': 6.9}","{'wins': 4, 'nominations': 5}","['Crime', 'Drama']",1987-05-08,United States,"['Crispin Glover', 'Keanu Reeves', 'Ione Skye']",['Tim Hunter']
tt0091875,Running Scared,Two street-wise Chicago cops have to shake off some rust after returning from a Key West vacation to pursue a drug dealer who nearly killed them in the past.,1h 47m,6420,"{'count': 14877, 'star': 6.5}","{'wins': 1, 'nominations': 1}","['Action', 'Comedy', 'Crime', 'Thriller']",1986-06-27,United States,"['Gregory Hines', 'Billy Crystal', 'Steven Bauer']",['Peter Hyams']
tt0092105,Tough Guys,Two elderly gangsters are released from prison only to find they have trouble fitting in as old men who still take no guff from anyone.,1h 44m,6240,"{'count': 7837, 'star': 6.2}","{'wins': 0, 'nominations': 1}","['Comedy', 'Crime']",1986-10-03,United States,"['Burt Lancaster', 'Kirk Douglas', 'Charles Durning']",['Jeff Kanew']
tt0092675,Bloodsport,"""Bloodsport"" follows Frank Dux, an American martial artist serving in the military, who decides to leave the army to compete in a martial arts tournament in Hong Kong where fights to the death can occur.",1h 32m,5520,"{'count': 93607, 'star': 6.8}","{'wins': 0, 'nominations': 1}","['Action', 'Biography', 'Drama', 'Sport']",1988-04-29,United States,"['Jean-Claude Van Damme', 'Donald Gibb', 'Leah Ayres']",['Newt Arnold']
tt0093058,Full Metal Jacket,A pragmatic U.S. Marine observes the dehumanizing effects the Vietnam War has on his fellow recruits from their brutal boot camp training to the bloody street fighting in Hue.,1h 56m,6960,"{'count': 787790, 'star': 8.3}","{'wins': 8, 'nominations': 15}","['Drama', 'War']",1987-07-10,United States,"['Matthew Modine', 'R. Lee Ermey', ""Vincent D'Onofrio""]",['Stanley Kubrick']
tt0093260,Innerspace,"A test pilot is miniaturized in a secret experiment, and accidentally injected into a hapless store clerk.",2h,7200,"{'count': 64902, 'star': 6.8}","{'wins': 2, 'nominations': 5}","['Action', 'Adventure', 'Comedy', 'Sci-Fi', 'Thriller']",1987-07-01,United States,"['Dennis Quaid', 'Martin Short', 'Meg Ryan']",['Joe Dante']
tt0093811,The Quick and the Dead,A mysterious stranger rides into a homesteading family's life when they are attacked by a ruthless gang.,1h 31m,5460,"{'count': 2485, 'star': 6.9}","{'wins': 0, 'nominations': 2}","['Drama', 'Western']",1987-02-28,United States,"['Sam Elliott', 'Tom Conti', 'Kate Capshaw']",['Robert Day']
tt0094082,Suspect,"When a homeless man is accused of murdering a Justice Department file clerk, a public defender is tasked with mounting his legal defense.",2h 1m,7260,"{'count': 11621, 'star': 6.6}","{'wins': 0, 'nominations': 0}","['Crime', 'Drama', 'Mystery', 'Thriller']",1987-10-23,United States,"['Cher', 'Dennis Quaid', 'Liam Neeson']",['Peter Yates']
tt0094651,Amsterdamned,A hard-boiled police detective sets out to capture a gruesome serial killer terrorizing the canals of Amsterdam.,1h 54m,6840,"{'count': 9436, 'star': 6.6}","{'wins': 0, 'nominations': 1}","['Action', 'Crime', 'Horror', 'Mystery', 'Thriller']",1988-11-25,United States,"['Huub Stapel', 'Monique van de Ven', 'Serge-Henri Valcke']",['Dick Maas']
tt0095016,Die Hard,A New York City police officer tries to save his estranged wife and several others taken hostage by terrorists during a Christmas party at the Nakatomi Plaza in Los Angeles.,2h 12m,7920,"{'count': 942006, 'star': 8.2}","{'wins': 8, 'nominations': 8}","['Action', 'Thriller']",1988-07-20,United States,"['Bruce Willis', 'Alan Rickman', 'Bonnie Bedelia']",['John McTiernan']
tt0095327,Grave of the Fireflies,A young boy and his little sister struggle to survive in Japan during World War II.,1h 29m,5340,"{'count': 308356, 'star': 8.5}","{'wins': 3, 'nominations': 0}","['Animation', 'Drama', 'War']",1989-07-26,United States,"['Tsutomu Tatsumi', 'Ayano Shiraishi', 'Akemi Yamaguchi']",['Isao Takahata']
tt0095765,Cinema Paradiso,A filmmaker recalls his childhood when falling in love with the pictures at the cinema of his home village and forms a deep friendship with the cinema's projectionist.,2h 54m,10440,"{'count': 281587, 'star': 8.5}","{'wins': 25, 'nominations': 32}","['Drama', 'Romance']",1990-02-23,United States,"['Philippe Noiret', 'Enzo Cannavale', 'Antonella Attili']",['Giuseppe Tornatore']
tt0096283,My Neighbor Totoro,"When two girls move to the country to be near their ailing mother, they have adventures with the wondrous forest spirits who live nearby.",1h 26m,5160,"{'count': 377916, 'star': 8.1}","{'wins': 5, 'nominations': 2}","['Animation', 'Comedy', 'Family', 'Fantasy']",1990-07-13,United States,"['Hitoshi Takagi', 'Noriko Hidaka', 'Chika Sakamoto']",['Hayao Miyazaki']
tt0097165,Dead Poets Society,"Maverick teacher John Keating returns in 1959 to the prestigious New England boys' boarding school where he was once a star student, using poetry to embolden his pupils to new heights of self-expression.",2h 8m,7680,"{'count': 542638, 'star': 8.1}","{'wins': 20, 'nominations': 19}","['Comedy', 'Drama']",1989-06-09,United States,"['Robin Williams', 'Robert Sean Leonard', 'Ethan Hawke']",['Peter Weir']
tt0097576,Indiana Jones and the Last Crusade,"In 1938, after his father goes missing while pursuing the Holy Grail, Indiana Jones finds himself up against the Nazis again to stop them from obtaining its powers.",2h 7m,7620,"{'count': 808542, 'star': 8.2}","{'wins': 9, 'nominations': 24}","['Action', 'Adventure']",1989-05-24,United States,"['Harrison Ford', 'Sean Connery', 'Alison Doody']",['Steven Spielberg']
tt0097662,Kill Me Again,A young detective becomes involved with a beautiful woman on the run from the mob and her psychopath boyfriend.,1h 34m,5640,"{'count': 5650, 'star': 6.3}","{'wins': 1, 'nominations': 0}","['Action', 'Crime', 'Drama', 'Thriller']",1989-10-27,United States,"['Val Kilmer', 'Joanne Whalley', 'Pat Mulligan']",['John Dahl']
tt0097967,Next of Kin,"Truman, a Chicago cop, sets out to find the killer of his brother. Meanwhile, another of his brothers, Briar (a hillbilly) decides to find the killer himself.",1h 48m,6480,"{'count': 12548, 'star': 5.8}","{'wins': 0, 'nominations': 1}","['Action', 'Crime', 'Drama', 'Thriller']",1989-10-20,United States,"['Patrick Swayze', 'Liam Neeson', 'Adam Baldwin']",['John Irvin']
tt0098439,Tango & Cash,"Framed by their ruthless arch-nemesis, a pair of mismatched LAPD officers must put their differences aside to get even with the brutal crime baron who sent them to rot in a maximum-security prison.",1h 44m,6240,"{'count': 113181, 'star': 6.4}","{'wins': 0, 'nominations': 3}","['Action', 'Comedy', 'Crime', 'Thriller']",1989-12-22,United States,"['Sylvester Stallone', 'Kurt Russell', 'Teri Hatcher']","['Andrey Konchalovskiy', 'Albert Magnoli']"
tt0098672,The Woman in Black,"A lawyer travels to a small seaside town to settle the estate of a recently deceased woman, but soon becomes ensnared in something much more sinister.",1h 42m,6120,"{'count': 6098, 'star': 7.1}","{'wins': 0, 'nominations': 4}","['Horror', 'Mystery']",1989-12-24,United Kingdom,"['Adrian Rawlins', 'Bernard Hepton', 'David Daker']",['Herbert Wise']
tt0099242,Chattahoochee,"In 1955 Florida, a Korean vet has a breakdown and is incarcerated in a ""maximum security"" mental health prison, where patients are abused.",1h 38m,5880,"{'count': 2411, 'star': 6.3}","{'wins': 0, 'nominations': 0}","['Biography', 'Drama']",1990-04-20,United States,"['Gary Oldman', 'Dennis Hopper', 'Frances McDormand']",['Mick Jackson']
tt0099348,Dances with Wolves,"Lieutenant John Dunbar, assigned to a remote western Civil War outpost, finds himself engaging with a neighbouring Sioux settlement, causing him to question his own purpose.",3h 1m,10860,"{'count': 289394, 'star': 8}","{'wins': 55, 'nominations': 39}","['Adventure', 'Drama', 'Western']",1990-11-21,United States,"['Kevin Costner', 'Mary McDonnell', 'Graham Greene']",['Kevin Costner']
tt0099460,Downtown,"An eager rookie cop gets transferred to a tough downtown Philadelphia precinct after stopping a powerful man for traffic violations. When his old cop buddy is murdered, he wants in on catching the killer.",1h 36m,5760,"{'count': 2161, 'star': 5.7}","{'wins': 0, 'nominations': 0}","['Action', 'Comedy', 'Crime', 'Drama']",1990-01-12,United States,"['Anthony Edwards', 'Forest Whitaker', 'Penelope Ann Miller']",['Richard Benjamin']
tt0099611,Frankenhooker,A medical student sets out to recreate his decapitated fiancée by building her a new body made of Manhattan street prostitutes.,1h 25m,5100,"{'count': 13391, 'star': 6.2}","{'wins': 0, 'nominations': 0}","['Comedy', 'Horror', 'Sci-Fi']",1990-06-01,United States,"['James Lorinz', 'Joanne Ritchie', 'Patty Mullen']",['Frank Henenlotter']
tt0099685,Goodfellas,"The story of Henry Hill and his life in the mafia, covering his relationship with his wife Karen and his mob partners Jimmy Conway and Tommy DeVito.",2h 25m,8700,"{'count': 1251630, 'star': 8.7}","{'wins': 44, 'nominations': 38}","['Biography', 'Crime', 'Drama']",1990-09-21,United States,"['Robert De Niro', 'Ray Liotta', 'Joe Pesci']",['Martin Scorsese']
tt0101628,Critters 4,"After being cryogenically frozen and waking up on a space station in the near future, the Critters aim to have the unwitting crew for lunch.",1h 27m,5220,"{'count': 8272, 'star': 4.1}","{'wins': 0, 'nominations': 0}","['Horror', 'Sci-Fi']",1992-10-14,United States,"['Don Keith Opper', 'Terrence Mann', 'Paul Whitthorne']",['Rupert Harvey']
tt0102004,The Hard Way,"An action movie star researching a role is allowed to tag along with a hardboiled New York City policeman, who finds him superficial and irritating.",1h 51m,6660,"{'count': 22234, 'star': 6.3}","{'wins': 0, 'nominations': 1}","['Action', 'Comedy', 'Crime']",1991-03-08,United States,"['Michael J. Fox', 'James Woods', 'Stephen Lang']",['John Badham']
tt0102266,The Last Boy Scout,"A private detective's protected female witness is murdered, prompting him and the victim's boyfriend to investigate the crime that leads to a corrupt politician and a crooked football team owner.",1h 45m,6300,"{'count': 111700, 'star': 7}","{'wins': 0, 'nominations': 2}","['Action', 'Comedy', 'Crime', 'Thriller']",1991-12-13,United States,"['Bruce Willis', 'Damon Wayans', 'Chelsea Field']",['Tony Scott']
tt0102926,The Silence of the Lambs,"A young F.B.I. cadet must receive the help of an incarcerated and manipulative cannibal killer to help catch another serial killer, a madman who skins his victims.",1h 58m,7080,"{'count': 1541349, 'star': 8.6}","{'wins': 71, 'nominations': 50}","['Crime', 'Drama', 'Thriller']",1991-02-14,United States,"['Jodie Foster', 'Anthony Hopkins', 'Scott Glenn']",['Jonathan Demme']
tt0103064,Terminator 2: Judgment Day,"A cyborg, identical to the one who failed to kill Sarah Connor, must now protect her ten year old son John from an even more advanced and powerful cyborg.",2h 17m,8220,"{'count': 1169357, 'star': 8.6}","{'wins': 39, 'nominations': 33}","['Action', 'Adventure', 'Sci-Fi']",1991-07-03,United States,"['Arnold Schwarzenegger', 'Linda Hamilton', 'Edward Furlong']",['James Cameron']
tt0103639,Aladdin,A kind-hearted street urchin and a power-hungry Grand Vizier vie for a magic lamp that has the power to make their deepest wishes come true.,1h 30m,5400,"{'count': 464350, 'star': 8}","{'wins': 35, 'nominations': 22}","['Animation', 'Adventure', 'Comedy', 'Family', 'Fantasy', 'Musical', 'Romance']",1992-11-25,United States,"['Scott Weinger', 'Robin Williams', 'Linda Larkin']","['Ron Clements', 'John Musker']"
tt0104265,Final Analysis,"A psychiatrist becomes romantically involved with the sister of one of his patients, but the influence of her controlling gangster husband threatens to destroy them both.",2h 4m,7440,"{'count': 15261, 'star': 5.9}","{'wins': 1, 'nominations': 4}","['Drama', 'Thriller']",1992-02-07,United States,"['Richard Gere', 'Kim Basinger', 'Uma Thurman']",['Phil Joanou']
tt0105236,Reservoir Dogs,"When a simple jewelry heist goes horribly wrong, the surviving criminals begin to suspect that one of them is a police informant.",1h 39m,5940,"{'count': 1083917, 'star': 8.3}","{'wins': 13, 'nominations': 23}","['Crime', 'Thriller']",1992-09-02,France,"['Harvey Keitel', 'Tim Roth', 'Michael Madsen']",['Quentin Tarantino']
tt0105417,Sister Act,"When a nightclub singer is forced to take refuge from the mob in a convent, she ends up turning the convent choir into a soulful chorus complete with a Motown repertoire, until the sudden celebrity of the choir jeopardizes her identity.",1h 40m,6000,"{'count': 107981, 'star': 6.5}","{'wins': 9, 'nominations': 10}","['Comedy', 'Family', 'Music']",1992-05-29,United States,"['Whoopi Goldberg', 'Maggie Smith', 'Harvey Keitel']",['Emile Ardolino']
tt0105695,Unforgiven,"Retired Old West gunslinger William Munny reluctantly takes on one last job, with the help of his old partner Ned Logan and a young man, The ""Schofield Kid.""",2h 10m,7800,"{'count': 434743, 'star': 8.2}","{'wins': 51, 'nominations': 47}","['Drama', 'Western']",1992-08-07,United States,"['Clint Eastwood', 'Gene Hackman', 'Morgan Freeman']",['Clint Eastwood']
tt0106308,Army of Darkness,"When Ash Williams is accidentally transported to 1300 A.D., he must retrieve the Necronomicon and battle an army of the dead in order to return home.",1h 21m,4860,"{'count': 193856, 'star': 7.4}","{'wins': 12, 'nominations': 7}","['Comedy', 'Horror']",1993-02-19,United States,"['Bruce Campbell', 'Embeth Davidtz', 'Marcus Gilbert']",['Sam Raimi']
tt0107048,Groundhog Day,"A narcissistic, self-centered weatherman finds himself in a time loop on Groundhog Day.",1h 41m,6060,"{'count': 682637, 'star': 8}","{'wins': 7, 'nominations': 17}","['Comedy', 'Drama', 'Fantasy', 'Romance']",1993-02-12,United States,"['Bill Murray', 'Andie MacDowell', 'Chris Elliott']",['Harold Ramis']
tt0107207,In the Name of the Father,"An Irish man's coerced confession to an I.R.A. bombing he did not commit results in the imprisonment of his father as well. Meanwhile, a British lawyer fights to clear their names and free them.",2h 13m,7980,"{'count': 186454, 'star': 8.1}","{'wins': 7, 'nominations': 41}","['Biography', 'Crime', 'Drama']",1994-02-25,United States,"['Daniel Day-Lewis', 'Pete Postlethwaite', 'Alison Crosbie']",['Jim Sheridan']
tt0107290,Jurassic Park,A pragmatic paleontologist touring an almost complete theme park on an island in Central America is tasked with protecting a couple of kids after a power failure causes the park's cloned dinosaurs to run loose.,2h 7m,7620,"{'count': 1062345, 'star': 8.2}","{'wins': 44, 'nominations': 27}","['Action', 'Adventure', 'Sci-Fi', 'Thriller']",1993-06-11,United States,"['Sam Neill', 'Laura Dern', 'Jeff Goldblum']",['Steven Spielberg']
tt0108052,Schindler's List,"In German-occupied Poland during World War II, industrialist Oskar Schindler gradually becomes concerned for his Jewish workforce after witnessing their persecution by the Nazis.",3h 15m,11700,"{'count': 1444091, 'star': 9}","{'wins': 91, 'nominations': 49}","['Biography', 'Drama', 'History']",1994-02-04,United States,"['Liam Neeson', 'Ralph Fiennes', 'Ben Kingsley']",['Steven Spielberg']
tt0109444,Clear and Present Danger,CIA Analyst Jack Ryan is drawn into an illegal war fought by the US government against a Colombian drug cartel.,2h 21m,8460,"{'count': 107627, 'star': 6.9}","{'wins': 3, 'nominations': 11}","['Action', 'Crime', 'Drama', 'Thriller']",1994-08-03,United States,"['Harrison Ford', 'Willem Dafoe', 'Anne Archer']",['Phillip Noyce']
tt0109830,Forrest Gump,"The history of the United States from the 1950s to the '70s unfolds from the perspective of an Alabama man with an IQ of 75, who yearns to be reunited with his childhood sweetheart.",2h 22m,8520,"{'count': 2245436, 'star': 8.8}","{'wins': 51, 'nominations': 74}","['Drama', 'Romance']",1994-07-06,United States,"['Tom Hanks', 'Robin Wright', 'Gary Sinise']",['Robert Zemeckis']
tt0109916,Godzilla vs. SpaceGodzilla,Godzilla is threatened by two new forces: Mogera - another UN built machine; and Space Godzilla - a beast spawned from Godzilla's particles in space.,1h 46m,6360,"{'count': 5512, 'star': 5.8}","{'wins': 0, 'nominations': 1}","['Action', 'Adventure', 'Sci-Fi']",1994-12-10,Japan,"['Jun Hashizume', 'Megumi Odaka', 'Zenkichi Yoneyama']","['Kenshô Yamashita', 'Takao Okawara', 'Kazuki Ômori']"
tt0110357,The Lion King,"Lion prince Simba and his father are targeted by his bitter uncle, who wants to ascend the throne himself.",1h 28m,5280,"{'count': 1137118, 'star': 8.5}","{'wins': 43, 'nominations': 35}","['Animation', 'Adventure', 'Drama', 'Family', 'Musical']",1994-06-24,United States,"['Matthew Broderick', 'Jeremy Irons', 'James Earl Jones']","['Roger Allers', 'Rob Minkoff']"
tt0110413,Léon: The Professional,"12-year-old Mathilda is reluctantly taken in by Léon, a professional assassin, after her family is murdered. An unusual relationship forms as she becomes his protégée and learns the assassin's trade.",1h 50m,6600,"{'count': 1240285, 'star': 8.5}","{'wins': 5, 'nominations': 16}","['Action', 'Crime', 'Drama', 'Thriller']",1994-11-18,United States,"['Jean Reno', 'Gary Oldman', 'Natalie Portman']",['Luc Besson']
tt0110912,Pulp Fiction,"The lives of two mob hitmen, a boxer, a gangster and his wife, and a pair of diner bandits intertwine in four tales of violence and redemption.",2h 34m,9240,"{'count': 2208881, 'star': 8.9}","{'wins': 69, 'nominations': 72}","['Crime', 'Drama']",1994-10-14,United States,"['John Travolta', 'Uma Thurman', 'Samuel L. Jackson']",['Quentin Tarantino']
tt0111161,The Shawshank Redemption,"Over the course of several years, two convicts form a friendship, seeking consolation and, eventually, redemption through basic compassion.",2h 22m,8520,"{'count': 2875039, 'star': 9.3}","{'wins': 21, 'nominations': 42}",['Drama'],1994-10-14,United States,"['Tim Robbins', 'Morgan Freeman', 'Bob Gunton']",['Frank Darabont']
tt0112442,Bad Boys,Two hip detectives protect a witness to a murder while investigating a case of stolen heroin from the evidence storage room from their police precinct.,1h 59m,7140,"{'count': 285152, 'star': 6.8}","{'wins': 1, 'nominations': 3}","['Action', 'Comedy', 'Crime', 'Thriller']",1995-04-07,United States,"['Will Smith', 'Martin Lawrence', 'Lisa Boyle']",['Michael Bay']
tt0112471,Before Sunrise,"A young man and woman meet on a train in Europe, and wind up spending one evening together in Vienna. Unfortunately, both know that this will probably be their only night together.",1h 41m,6060,"{'count': 337850, 'star': 8.1}","{'wins': 1, 'nominations': 7}","['Drama', 'Romance']",1995-01-27,United States,"['Ethan Hawke', 'Julie Delpy', 'Andrea Eckert']",['Richard Linklater']
tt0112573,Braveheart,Scottish warrior William Wallace leads his countrymen in a rebellion to free his homeland from the tyranny of King Edward I of England.,2h 58m,10680,"{'count': 1088269, 'star': 8.3}","{'wins': 34, 'nominations': 34}","['Biography', 'Drama', 'War']",1995-05-24,United States,"['Mel Gibson', 'Sophie Marceau', 'Patrick McGoohan']",['Mel Gibson']
tt0112641,Casino,"In Las Vegas, two best friends - a casino executive and a mafia enforcer - compete for a gambling empire and a fast-living, fast-loving socialite.",2h 58m,10680,"{'count': 561492, 'star': 8.2}","{'wins': 4, 'nominations': 11}","['Crime', 'Drama']",1995-11-22,United States,"['Robert De Niro', 'Sharon Stone', 'Joe Pesci']",['Martin Scorsese']
